{
  "$schema": "../theme.schema.json", "schemaVersion": 1, "id": "cobalt2", "label": "Cobalt2", "scheme": "dark",
  "color": {
    "bg-0": "#15232d", "bg-1": "#122738", "bg-2": "#193549", "bg-3": "#15232d", "bg-4": "#354d5f", "bg-input": "#193549",
    "border-subtle": "#354d5f", "border": "#475d6d", "border-strong": "#637683",
    "text-0": "#ffffff", "text-1": "#ffffff", "text-2": "#aaaaaa", "text-3": "#6c7e8b",
    "accent": "#0088ff", "accent-dim": "rgba(0,136,255,0.14)", "accent-bd": "rgba(0,136,255,0.4)", "accent-fg": "#000000",
    "selection": "#0050a4", "selection-fg": "#ffffff", "status": "#0088ff", "status-fg": "#000000",
    "live": "#ffc600", "live-dim": "rgba(255,198,0,0.14)", "live-bd": "rgba(255,198,0,0.38)", "compact-zone": "rgba(255,198,0,0.29)",
    "success": "#3ad900", "success-dim": "rgba(58,217,0,0.14)", "success-bd": "rgba(58,217,0,0.36)",
    "danger": "#ff628c", "danger-dim": "rgba(255,98,140,0.14)", "danger-bd": "rgba(255,98,140,0.38)", "danger-fg": "#000000",
    "warning": "#ffc600", "warning-dim": "rgba(255,198,0,0.14)", "warning-bd": "rgba(255,198,0,0.38)", "warning-fg": "#000000",
    "grid": "rgba(255,255,255,.07)", "scrim": "rgba(0,0,0,.64)", "shadow": "rgba(0,0,0,.45)", "shadow-strong": "rgba(0,0,0,.7)"
  },
  "shape": {"radius-window": "9px","radius-panel": "11px","radius-card": "10px","radius-button": "7px","radius-input": "8px","radius-pill": "6px","radius-badge": "5px","border-width": "1px","focus-ring-width": "2px"}
}
