{
  "$schema": "../theme.schema.json", "schemaVersion": 1, "id": "github-dark", "label": "GitHub Dark", "scheme": "dark",
  "color": {
    "bg-0": "#0d1117", "bg-1": "#010409", "bg-2": "#161b22", "bg-3": "#21262d", "bg-4": "#30363d", "bg-input": "#0d1117",
    "border-subtle": "#21262d", "border": "#30363d", "border-strong": "#484f58",
    "text-0": "#f0f6fc", "text-1": "#c9d1d9", "text-2": "#8b949e", "text-3": "#7d8590",
    "accent": "#58a6ff", "accent-dim": "rgba(88,166,255,.14)", "accent-bd": "rgba(88,166,255,.42)", "accent-fg": "#0d1117",
    "selection": "#264f78", "selection-fg": "#ffffff", "status": "#1f6feb", "status-fg": "#ffffff",
    "live": "#d29922", "live-dim": "rgba(210,153,34,.14)", "live-bd": "rgba(210,153,34,.38)", "compact-zone": "rgba(210,153,34,.3)",
    "success": "#3fb950", "success-dim": "rgba(63,185,80,.14)", "success-bd": "rgba(63,185,80,.36)",
    "danger": "#f85149", "danger-dim": "rgba(248,81,73,.14)", "danger-bd": "rgba(248,81,73,.38)", "danger-fg": "#000000",
    "warning": "#d29922", "warning-dim": "rgba(210,153,34,.14)", "warning-bd": "rgba(210,153,34,.38)", "warning-fg": "#000000",
    "grid": "rgba(240,246,252,.07)", "scrim": "rgba(1,4,9,.68)", "shadow": "rgba(1,4,9,.5)", "shadow-strong": "rgba(1,4,9,.75)"
  },
  "shape": { "radius-window": "9px", "radius-panel": "11px", "radius-card": "10px", "radius-button": "7px", "radius-input": "8px", "radius-pill": "6px", "radius-badge": "5px", "border-width": "1px", "focus-ring-width": "2px" }
}
