{
  "$schema": "../theme.schema.json", "schemaVersion": 1, "id": "shades-of-purple", "label": "Shades of Purple", "scheme": "dark",
  "color": {
    "bg-0": "#1e1e3f", "bg-1": "#222244", "bg-2": "#2d2b55", "bg-3": "#222244", "bg-4": "#464469", "bg-input": "#2d2b55",
    "border-subtle": "#464469", "border": "#575577", "border-strong": "#706f8b",
    "text-0": "#ffffff", "text-1": "#ffffff", "text-2": "#a599e9", "text-3": "#797792",
    "accent": "#b362ff", "accent-dim": "rgba(179,98,255,0.14)", "accent-bd": "rgba(179,98,255,0.4)", "accent-fg": "#000000",
    "selection": "#7448b0", "selection-fg": "#ffffff", "status": "#b362ff", "status-fg": "#000000",
    "live": "#fad000", "live-dim": "rgba(250,208,0,0.14)", "live-bd": "rgba(250,208,0,0.38)", "compact-zone": "rgba(250,208,0,0.29)",
    "success": "#3ad900", "success-dim": "rgba(58,217,0,0.14)", "success-bd": "rgba(58,217,0,0.36)",
    "danger": "#e53938", "danger-dim": "rgba(229,57,56,0.14)", "danger-bd": "rgba(229,57,56,0.38)", "danger-fg": "#000000",
    "warning": "#fad000", "warning-dim": "rgba(250,208,0,0.14)", "warning-bd": "rgba(250,208,0,0.38)", "warning-fg": "#000000",
    "grid": "rgba(255,255,255,.07)", "scrim": "rgba(0,0,0,.64)", "shadow": "rgba(0,0,0,.45)", "shadow-strong": "rgba(0,0,0,.7)"
  },
  "shape": {"radius-window": "9px","radius-panel": "11px","radius-card": "10px","radius-button": "7px","radius-input": "8px","radius-pill": "6px","radius-badge": "5px","border-width": "1px","focus-ring-width": "2px"}
}
