{
  "$schema": "../theme.schema.json", "schemaVersion": 1, "id": "tokyo-night", "label": "Tokyo Night", "scheme": "dark",
  "color": {
    "bg-0": "#16161e", "bg-1": "#16161e", "bg-2": "#1a1b26", "bg-3": "#16161e", "bg-4": "#353640", "bg-input": "#14141b",
    "border-subtle": "#353640", "border": "#484951", "border-strong": "#63646b",
    "text-0": "#a9b1d6", "text-1": "#a9b1d6", "text-2": "#83848a", "text-3": "#66666e",
    "accent": "#7aa2f7", "accent-dim": "rgba(122,162,247,0.14)", "accent-bd": "rgba(122,162,247,0.4)", "accent-fg": "#000000",
    "selection": "#2b2f41", "selection-fg": "#a9b1d6", "status": "#7aa2f7", "status-fg": "#000000",
    "live": "#e0af68", "live-dim": "rgba(224,175,104,0.14)", "live-bd": "rgba(224,175,104,0.38)", "compact-zone": "rgba(224,175,104,0.29)",
    "success": "#73daca", "success-dim": "rgba(115,218,202,0.14)", "success-bd": "rgba(115,218,202,0.36)",
    "danger": "#f7768e", "danger-dim": "rgba(247,118,142,0.14)", "danger-bd": "rgba(247,118,142,0.38)", "danger-fg": "#000000",
    "warning": "#e0af68", "warning-dim": "rgba(224,175,104,0.14)", "warning-bd": "rgba(224,175,104,0.38)", "warning-fg": "#000000",
    "grid": "rgba(255,255,255,.07)", "scrim": "rgba(0,0,0,.64)", "shadow": "rgba(0,0,0,.45)", "shadow-strong": "rgba(0,0,0,.7)"
  },
  "shape": {"radius-window": "9px","radius-panel": "11px","radius-card": "10px","radius-button": "7px","radius-input": "8px","radius-pill": "6px","radius-badge": "5px","border-width": "1px","focus-ring-width": "2px"}
}
