{
  "$schema": "../theme.schema.json", "schemaVersion": 1, "id": "gruvbox-dark-medium", "label": "Gruvbox Dark Medium", "scheme": "dark",
  "color": {
    "bg-0": "#282828", "bg-1": "#282828", "bg-2": "#282828", "bg-3": "#282828", "bg-4": "#424242", "bg-input": "#282828",
    "border-subtle": "#424242", "border": "#535353", "border-strong": "#6d6d6d",
    "text-0": "#ebdbb2", "text-1": "#ebdbb2", "text-2": "#8f8f8f", "text-3": "#717171",
    "accent": "#83a598", "accent-dim": "rgba(131,165,152,0.14)", "accent-bd": "rgba(131,165,152,0.4)", "accent-fg": "#000000",
    "selection": "#384539", "selection-fg": "#ebdbb2", "status": "#83a598", "status-fg": "#000000",
    "live": "#d79921", "live-dim": "rgba(215,153,33,0.14)", "live-bd": "rgba(215,153,33,0.38)", "compact-zone": "rgba(215,153,33,0.29)",
    "success": "#98971a", "success-dim": "rgba(152,151,26,0.14)", "success-bd": "rgba(152,151,26,0.36)",
    "danger": "#cc241d", "danger-dim": "rgba(204,36,29,0.14)", "danger-bd": "rgba(204,36,29,0.38)", "danger-fg": "#ffffff",
    "warning": "#d79921", "warning-dim": "rgba(215,153,33,0.14)", "warning-bd": "rgba(215,153,33,0.38)", "warning-fg": "#000000",
    "grid": "rgba(255,255,255,.07)", "scrim": "rgba(0,0,0,.64)", "shadow": "rgba(0,0,0,.45)", "shadow-strong": "rgba(0,0,0,.7)"
  },
  "shape": {"radius-window": "9px","radius-panel": "11px","radius-card": "10px","radius-button": "7px","radius-input": "8px","radius-pill": "6px","radius-badge": "5px","border-width": "1px","focus-ring-width": "2px"}
}
