{
  "$schema": "../theme.schema.json", "schemaVersion": 1, "id": "atom-one-dark", "label": "Atom One Dark", "scheme": "dark",
  "color": {
    "bg-0": "#21252b", "bg-1": "#333842", "bg-2": "#282c34", "bg-3": "#21252b", "bg-4": "#42454c", "bg-input": "#1b1d23",
    "border-subtle": "#42454c", "border": "#53565d", "border-strong": "#6d7075",
    "text-0": "#b2b8c4", "text-1": "#abb2bf", "text-2": "#94969a", "text-3": "#73767b",
    "accent": "#528bff", "accent-dim": "rgba(82,139,255,0.14)", "accent-bd": "rgba(82,139,255,0.4)", "accent-fg": "#000000",
    "selection": "#3e4451", "selection-fg": "#b2b8c4", "status": "#528bff", "status-fg": "#000000",
    "live": "#e5c07b", "live-dim": "rgba(229,192,123,0.14)", "live-bd": "rgba(229,192,123,0.38)", "compact-zone": "rgba(229,192,123,0.29)",
    "success": "#98c379", "success-dim": "rgba(152,195,121,0.14)", "success-bd": "rgba(152,195,121,0.36)",
    "danger": "#e06c75", "danger-dim": "rgba(224,108,117,0.14)", "danger-bd": "rgba(224,108,117,0.38)", "danger-fg": "#000000",
    "warning": "#e5c07b", "warning-dim": "rgba(229,192,123,0.14)", "warning-bd": "rgba(229,192,123,0.38)", "warning-fg": "#000000",
    "grid": "rgba(255,255,255,.07)", "scrim": "rgba(0,0,0,.64)", "shadow": "rgba(0,0,0,.45)", "shadow-strong": "rgba(0,0,0,.7)"
  },
  "shape": {"radius-window": "9px","radius-panel": "11px","radius-card": "10px","radius-button": "7px","radius-input": "8px","radius-pill": "6px","radius-badge": "5px","border-width": "1px","focus-ring-width": "2px"}
}
