{
  "$schema": "../theme.schema.json", "schemaVersion": 1, "id": "sublime-material-dark", "label": "Sublime Material Dark", "scheme": "dark",
  "color": {
    "bg-0": "#212121", "bg-1": "#222223", "bg-2": "#252526", "bg-3": "#323233", "bg-4": "#3f3f40", "bg-input": "#222223",
    "border-subtle": "#3f3f40", "border": "#515151", "border-strong": "#6b6b6b",
    "text-0": "#eeffff", "text-1": "#eeffff", "text-2": "#8e8e8e", "text-3": "#6f6f70",
    "accent": "#80cbc4", "accent-dim": "rgba(128,203,196,0.14)", "accent-bd": "rgba(128,203,196,0.4)", "accent-fg": "#000000",
    "selection": "#37474f", "selection-fg": "#eeffff", "status": "#80cbc4", "status-fg": "#000000",
    "live": "#ffcb6b", "live-dim": "rgba(255,203,107,0.14)", "live-bd": "rgba(255,203,107,0.38)", "compact-zone": "rgba(255,203,107,0.29)",
    "success": "#c3e88d", "success-dim": "rgba(195,232,141,0.14)", "success-bd": "rgba(195,232,141,0.36)",
    "danger": "#ff5370", "danger-dim": "rgba(255,83,112,0.14)", "danger-bd": "rgba(255,83,112,0.38)", "danger-fg": "#000000",
    "warning": "#ffcb6b", "warning-dim": "rgba(255,203,107,0.14)", "warning-bd": "rgba(255,203,107,0.38)", "warning-fg": "#000000",
    "grid": "rgba(255,255,255,.07)", "scrim": "rgba(0,0,0,.64)", "shadow": "rgba(0,0,0,.45)", "shadow-strong": "rgba(0,0,0,.7)"
  },
  "shape": {"radius-window": "9px","radius-panel": "11px","radius-card": "10px","radius-button": "7px","radius-input": "8px","radius-pill": "6px","radius-badge": "5px","border-width": "1px","focus-ring-width": "2px"}
}
