{
  "$schema": "../theme.schema.json", "schemaVersion": 1, "id": "jellyfish", "label": "JellyFish", "scheme": "dark",
  "color": {
    "bg-0": "#000124", "bg-1": "#0a0025", "bg-2": "#00002c", "bg-3": "#141222", "bg-4": "#1f1f45", "bg-input": "#28002b",
    "border-subtle": "#1f1f45", "border": "#333356", "border-strong": "#525270",
    "text-0": "#ffffff", "text-1": "#ffffff", "text-2": "#ffffff", "text-3": "#595976",
    "accent": "#00d9ff", "accent-dim": "rgba(0,217,255,0.14)", "accent-bd": "rgba(0,217,255,0.4)", "accent-fg": "#000000",
    "selection": "#5d004e", "selection-fg": "#ffffff", "status": "#00d9ff", "status-fg": "#000000",
    "live": "#e5c07b", "live-dim": "rgba(229,192,123,0.14)", "live-bd": "rgba(229,192,123,0.38)", "compact-zone": "rgba(229,192,123,0.29)",
    "success": "#98c379", "success-dim": "rgba(152,195,121,0.14)", "success-bd": "rgba(152,195,121,0.36)",
    "danger": "#e06c75", "danger-dim": "rgba(224,108,117,0.14)", "danger-bd": "rgba(224,108,117,0.38)", "danger-fg": "#000000",
    "warning": "#e5c07b", "warning-dim": "rgba(229,192,123,0.14)", "warning-bd": "rgba(229,192,123,0.38)", "warning-fg": "#000000",
    "grid": "rgba(255,255,255,.07)", "scrim": "rgba(0,0,0,.64)", "shadow": "rgba(0,0,0,.45)", "shadow-strong": "rgba(0,0,0,.7)"
  },
  "shape": {"radius-window": "9px","radius-panel": "11px","radius-card": "10px","radius-button": "7px","radius-input": "8px","radius-pill": "6px","radius-badge": "5px","border-width": "1px","focus-ring-width": "2px"}
}
