{
  "$schema": "../theme.schema.json", "schemaVersion": 1, "id": "ayu-mirage", "label": "Ayu Mirage", "scheme": "dark",
  "color": {
    "bg-0": "#1f2430", "bg-1": "#1f2430", "bg-2": "#1f2430", "bg-3": "#282e3b", "bg-4": "#3a3e49", "bg-input": "#242936",
    "border-subtle": "#3a3e49", "border": "#4c5059", "border-strong": "#676a72",
    "text-0": "#cccac2", "text-1": "#cccac2", "text-2": "#8b8d93", "text-3": "#6b6e76",
    "accent": "#ffcc66", "accent-dim": "rgba(255,204,102,0.14)", "accent-bd": "rgba(255,204,102,0.4)", "accent-fg": "#000000",
    "selection": "#274364", "selection-fg": "#cccac2", "status": "#ffcc66", "status-fg": "#000000",
    "live": "#fcca60", "live-dim": "rgba(252,202,96,0.14)", "live-bd": "rgba(252,202,96,0.38)", "compact-zone": "rgba(252,202,96,0.29)",
    "success": "#87d96c", "success-dim": "rgba(135,217,108,0.14)", "success-bd": "rgba(135,217,108,0.36)",
    "danger": "#f28273", "danger-dim": "rgba(242,130,115,0.14)", "danger-bd": "rgba(242,130,115,0.38)", "danger-fg": "#000000",
    "warning": "#fcca60", "warning-dim": "rgba(252,202,96,0.14)", "warning-bd": "rgba(252,202,96,0.38)", "warning-fg": "#000000",
    "grid": "rgba(255,255,255,.07)", "scrim": "rgba(0,0,0,.64)", "shadow": "rgba(0,0,0,.45)", "shadow-strong": "rgba(0,0,0,.7)"
  },
  "shape": {"radius-window": "9px","radius-panel": "11px","radius-card": "10px","radius-button": "7px","radius-input": "8px","radius-pill": "6px","radius-badge": "5px","border-width": "1px","focus-ring-width": "2px"}
}
