{
  "$schema": "../theme.schema.json", "schemaVersion": 1, "id": "one-dark-pro", "label": "One Dark Pro", "scheme": "dark",
  "color": {
    "bg-0": "#21252b", "bg-1": "#282c34", "bg-2": "#282c34", "bg-3": "#21252b", "bg-4": "#42454c", "bg-input": "#1d1f23",
    "border-subtle": "#42454c", "border": "#53565d", "border-strong": "#6d7075",
    "text-0": "#b2b8c4", "text-1": "#abb2bf", "text-2": "#abb2bf", "text-3": "#73767b",
    "accent": "#61afef", "accent-dim": "rgba(97,175,239,0.14)", "accent-bd": "rgba(97,175,239,0.4)", "accent-fg": "#000000",
    "selection": "#404859", "selection-fg": "#b2b8c4", "status": "#61afef", "status-fg": "#000000",
    "live": "#d18f52", "live-dim": "rgba(209,143,82,0.14)", "live-bd": "rgba(209,143,82,0.38)", "compact-zone": "rgba(209,143,82,0.29)",
    "success": "#8cc265", "success-dim": "rgba(140,194,101,0.14)", "success-bd": "rgba(140,194,101,0.36)",
    "danger": "#e05561", "danger-dim": "rgba(224,85,97,0.14)", "danger-bd": "rgba(224,85,97,0.38)", "danger-fg": "#000000",
    "warning": "#d18f52", "warning-dim": "rgba(209,143,82,0.14)", "warning-bd": "rgba(209,143,82,0.38)", "warning-fg": "#000000",
    "grid": "rgba(255,255,255,.07)", "scrim": "rgba(0,0,0,.64)", "shadow": "rgba(0,0,0,.45)", "shadow-strong": "rgba(0,0,0,.7)"
  },
  "shape": {"radius-window": "9px","radius-panel": "11px","radius-card": "10px","radius-button": "7px","radius-input": "8px","radius-pill": "6px","radius-badge": "5px","border-width": "1px","focus-ring-width": "2px"}
}
